<?xml version="1.0" encoding="UTF-8"?>
<!--  Exemple invalid: Element 'passos': Missing child element  -->
<!--
        Javier Amaya Boira
        11/12/2022
        ASIXc M04 UF1 A2
        Pr2 XSD exercici 2
-->
<receptes xmlns:xsi="http://www.w3.org/2001/XMLSchema-instance" xsi:noNamespaceSchemaLocation="e2_receptes.xsd">
    <recepta dificultat="5">
        <nom>Papates amb llet</nom>
        <ingredients>
            <ingredient>
                <quantitat>
                    <valor>2</valor>
                    <mesura>grams</mesura>
                </quantitat>
                <nom>all</nom>
            </ingredient>
        </ingredients>
        <passos>
        </passos>
    </recepta>
</receptes>
