<?xml version="1.0" encoding="UTF-8"?>
<!--  Exemple invalid: 'valor': dificultat va entre 0 i 10  -->
<!--
        Javier Amaya Boira
        11/12/2022
        ASIXc M04 UF1 A2
        Pr2 XSD exercici 2
-->

<receptes xmlns:xsi="http://www.w3.org/2001/XMLSchema-instance" xsi:noNamespaceSchemaLocation="e2_receptes.xsd">
    <recepta dificultat="100">
        <nom>Papates amb llet</nom>
        <ingredients>
            <ingredient>
                <quantitat>
                    <valor>2</valor>
                    <mesura>grams</mesura>
                </quantitat>
                <nom>all</nom>
            </ingredient>
        </ingredients>
        <passos>
            <pas>Fregir patates</pas>
            <pas>Posar-hi la llet</pas>
            <pas>deixar refredar</pas>
        </passos>
    </recepta>
    <recepta dificultat="-1">
        <nom>Papates amb llet2</nom>
        <ingredients>
            <ingredient>
                <quantitat>
                    <valor>2</valor>
                    <mesura>grams</mesura>
                </quantitat>
                <nom>all</nom>
            </ingredient>
        </ingredients>
        <passos>
            <pas>Fregir patates</pas>
            <pas>Posar-hi la llet</pas>
            <pas>Batir</pas>
            <pas>deixar refredar</pas>
        </passos>
    </recepta>
</receptes>
